[
  {
    "id": "rel-1",
    "sourceId": "adam",
    "targetId": "eve",
    "type": "family-spouse",
    "confidence": "high"
  },
  {
    "id": "rel-2",
    "sourceId": "adam",
    "targetId": "cain",
    "type": "family-child",
    "confidence": "high"
  },
  {
    "id": "rel-3",
    "sourceId": "adam",
    "targetId": "abel",
    "type": "family-child",
    "confidence": "high"
  },
  {
    "id": "rel-4",
    "sourceId": "adam",
    "targetId": "seth",
    "type": "family-child",
    "confidence": "high"
  },
  {
    "id": "rel-5",
    "sourceId": "adam",
    "targetId": "creation",
    "type": "event-participant",
    "confidence": "high"
  },
  {
    "id": "rel-6",
    "sourceId": "adam",
    "targetId": "the-fall",
    "type": "event-participant",
    "confidence": "high"
  },
  {
    "id": "rel-7",
    "sourceId": "adam",
    "targetId": "cain",
    "type": "event-participant",
    "confidence": "high"
  },
  {
    "id": "rel-8",
    "sourceId": "adam",
    "targetId": "abel",
    "type": "event-participant",
    "confidence": "high"
  },
  {
    "id": "rel-9",
    "sourceId": "adam",
    "targetId": "eve",
    "type": "event-participant",
    "confidence": "high"
  },
  {
    "id": "rel-10",
    "sourceId": "adam",
    "targetId": "seth",
    "type": "event-participant",
    "confidence": "high"
  },
  {
    "id": "rel-11",
    "sourceId": "adam",
    "targetId": "genesis",
    "type": "book-subject",
    "confidence": "high"
  },
  {
    "id": "rel-12",
    "sourceId": "eve",
    "targetId": "adam",
    "type": "family-spouse",
    "confidence": "high"
  },
  {
    "id": "rel-13",
    "sourceId": "eve",
    "targetId": "cain",
    "type": "family-child",
    "confidence": "high"
  },
  {
    "id": "rel-14",
    "sourceId": "eve",
    "targetId": "abel",
    "type": "family-child",
    "confidence": "high"
  },
  {
    "id": "rel-15",
    "sourceId": "eve",
    "targetId": "seth",
    "type": "family-child",
    "confidence": "high"
  },
  {
    "id": "rel-16",
    "sourceId": "eve",
    "targetId": "creation",
    "type": "event-participant",
    "confidence": "high"
  },
  {
    "id": "rel-17",
    "sourceId": "eve",
    "targetId": "the-fall",
    "type": "event-participant",
    "confidence": "high"
  },
  {
    "id": "rel-18",
    "sourceId": "eve",
    "targetId": "adam",
    "type": "event-participant",
    "confidence": "high"
  },
  {
    "id": "rel-19",
    "sourceId": "eve",
    "targetId": "cain",
    "type": "event-participant",
    "confidence": "high"
  },
  {
    "id": "rel-20",
    "sourceId": "eve",
    "targetId": "abel",
    "type": "event-participant",
    "confidence": "high"
  },
  {
    "id": "rel-21",
    "sourceId": "eve",
    "targetId": "seth",
    "type": "event-participant",
    "confidence": "high"
  },
  {
    "id": "rel-22",
    "sourceId": "eve",
    "targetId": "genesis",
    "type": "book-subject",
    "confidence": "high"
  },
  {
    "id": "rel-23",
    "sourceId": "cain",
    "targetId": "the-fall",
    "type": "event-participant",
    "confidence": "high"
  },
  {
    "id": "rel-24",
    "sourceId": "cain",
    "targetId": "adam",
    "type": "event-participant",
    "confidence": "high"
  },
  {
    "id": "rel-25",
    "sourceId": "cain",
    "targetId": "eve",
    "type": "event-participant",
    "confidence": "high"
  },
  {
    "id": "rel-26",
    "sourceId": "cain",
    "targetId": "abel",
    "type": "event-participant",
    "confidence": "high"
  },
  {
    "id": "rel-27",
    "sourceId": "cain",
    "targetId": "seth",
    "type": "event-participant",
    "confidence": "high"
  },
  {
    "id": "rel-28",
    "sourceId": "cain",
    "targetId": "genesis",
    "type": "book-subject",
    "confidence": "high"
  },
  {
    "id": "rel-29",
    "sourceId": "abel",
    "targetId": "the-fall",
    "type": "event-participant",
    "confidence": "high"
  },
  {
    "id": "rel-30",
    "sourceId": "abel",
    "targetId": "adam",
    "type": "event-participant",
    "confidence": "high"
  },
  {
    "id": "rel-31",
    "sourceId": "abel",
    "targetId": "eve",
    "type": "event-participant",
    "confidence": "high"
  },
  {
    "id": "rel-32",
    "sourceId": "abel",
    "targetId": "cain",
    "type": "event-participant",
    "confidence": "high"
  },
  {
    "id": "rel-33",
    "sourceId": "abel",
    "targetId": "seth",
    "type": "event-participant",
    "confidence": "high"
  },
  {
    "id": "rel-34",
    "sourceId": "abel",
    "targetId": "genesis",
    "type": "book-subject",
    "confidence": "high"
  },
  {
    "id": "rel-35",
    "sourceId": "seth",
    "targetId": "the-fall",
    "type": "event-participant",
    "confidence": "high"
  },
  {
    "id": "rel-36",
    "sourceId": "seth",
    "targetId": "adam",
    "type": "event-participant",
    "confidence": "high"
  },
  {
    "id": "rel-37",
    "sourceId": "seth",
    "targetId": "eve",
    "type": "event-participant",
    "confidence": "high"
  },
  {
    "id": "rel-38",
    "sourceId": "seth",
    "targetId": "cain",
    "type": "event-participant",
    "confidence": "high"
  },
  {
    "id": "rel-39",
    "sourceId": "seth",
    "targetId": "abel",
    "type": "event-participant",
    "confidence": "high"
  },
  {
    "id": "rel-40",
    "sourceId": "seth",
    "targetId": "noah",
    "type": "event-participant",
    "confidence": "high"
  },
  {
    "id": "rel-41",
    "sourceId": "seth",
    "targetId": "genesis",
    "type": "book-subject",
    "confidence": "high"
  },
  {
    "id": "rel-49",
    "sourceId": "noah",
    "targetId": "genesis",
    "type": "book-subject",
    "confidence": "high"
  },
  {
    "id": "rel-52",
    "sourceId": "abraham",
    "targetId": "isaac",
    "type": "family-child",
    "confidence": "high"
  },
  {
    "id": "rel-55",
    "sourceId": "abraham",
    "targetId": "ishmael-born",
    "type": "event-participant",
    "confidence": "high"
  },
  {
    "id": "rel-58",
    "sourceId": "abraham",
    "targetId": "isaac",
    "type": "event-participant",
    "confidence": "high"
  },
  {
    "id": "rel-59",
    "sourceId": "abraham",
    "targetId": "jacob",
    "type": "event-participant",
    "confidence": "high"
  },
  {
    "id": "rel-60",
    "sourceId": "abraham",
    "targetId": "noah",
    "type": "event-participant",
    "confidence": "high"
  },
  {
    "id": "rel-61",
    "sourceId": "abraham",
    "targetId": "genesis",
    "type": "book-subject",
    "confidence": "high"
  },
  {
    "id": "rel-62",
    "sourceId": "isaac",
    "targetId": "abraham",
    "type": "family-parent",
    "confidence": "high"
  },
  {
    "id": "rel-65",
    "sourceId": "isaac",
    "targetId": "jacob",
    "type": "family-child",
    "confidence": "high"
  },
  {
    "id": "rel-68",
    "sourceId": "isaac",
    "targetId": "abraham",
    "type": "event-participant",
    "confidence": "high"
  },
  {
    "id": "rel-71",
    "sourceId": "isaac",
    "targetId": "jacob",
    "type": "event-participant",
    "confidence": "high"
  },
  {
    "id": "rel-73",
    "sourceId": "isaac",
    "targetId": "genesis",
    "type": "book-subject",
    "confidence": "high"
  },
  {
    "id": "rel-74",
    "sourceId": "jacob",
    "targetId": "isaac",
    "type": "family-parent",
    "confidence": "high"
  },
  {
    "id": "rel-77",
    "sourceId": "jacob",
    "targetId": "joseph",
    "type": "family-child",
    "confidence": "high"
  },
  {
    "id": "rel-80",
    "sourceId": "jacob",
    "targetId": "levi",
    "type": "family-child",
    "confidence": "high"
  },
  {
    "id": "rel-81",
    "sourceId": "jacob",
    "targetId": "judah",
    "type": "family-child",
    "confidence": "high"
  },
  {
    "id": "rel-90",
    "sourceId": "jacob",
    "targetId": "isaac",
    "type": "event-participant",
    "confidence": "high"
  },
  {
    "id": "rel-94",
    "sourceId": "jacob",
    "targetId": "levi",
    "type": "event-participant",
    "confidence": "high"
  },
  {
    "id": "rel-95",
    "sourceId": "jacob",
    "targetId": "judah",
    "type": "event-participant",
    "confidence": "high"
  },
  {
    "id": "rel-96",
    "sourceId": "jacob",
    "targetId": "joseph",
    "type": "event-participant",
    "confidence": "high"
  },
  {
    "id": "rel-97",
    "sourceId": "jacob",
    "targetId": "genesis",
    "type": "book-subject",
    "confidence": "high"
  },
  {
    "id": "rel-99",
    "sourceId": "levi",
    "targetId": "jacob",
    "type": "event-participant",
    "confidence": "high"
  },
  {
    "id": "rel-101",
    "sourceId": "levi",
    "targetId": "judah",
    "type": "event-participant",
    "confidence": "high"
  },
  {
    "id": "rel-102",
    "sourceId": "levi",
    "targetId": "joseph",
    "type": "event-participant",
    "confidence": "high"
  },
  {
    "id": "rel-103",
    "sourceId": "levi",
    "targetId": "moses",
    "type": "event-participant",
    "confidence": "high"
  },
  {
    "id": "rel-104",
    "sourceId": "levi",
    "targetId": "aaron",
    "type": "event-participant",
    "confidence": "high"
  },
  {
    "id": "rel-105",
    "sourceId": "levi",
    "targetId": "genesis",
    "type": "book-subject",
    "confidence": "high"
  },
  {
    "id": "rel-107",
    "sourceId": "judah",
    "targetId": "jacob",
    "type": "event-participant",
    "confidence": "high"
  },
  {
    "id": "rel-109",
    "sourceId": "judah",
    "targetId": "levi",
    "type": "event-participant",
    "confidence": "high"
  },
  {
    "id": "rel-110",
    "sourceId": "judah",
    "targetId": "joseph",
    "type": "event-participant",
    "confidence": "high"
  },
  {
    "id": "rel-111",
    "sourceId": "judah",
    "targetId": "david",
    "type": "event-participant",
    "confidence": "high"
  },
  {
    "id": "rel-112",
    "sourceId": "judah",
    "targetId": "genesis",
    "type": "book-subject",
    "confidence": "high"
  },
  {
    "id": "rel-113",
    "sourceId": "joseph",
    "targetId": "jacob",
    "type": "family-parent",
    "confidence": "high"
  },
  {